{
  "$schema": "../schemas/catalog.schema.json",
  "framework": "HELM",
  "version": "1.0.0",
  "count_law": 15,
  "note": "Each language is an original design language with documented lineage. Lineage fields are study references only. Palette hex values are HELM-original token sets, not sampled from any screen.",
  "languages": [
    {
      "id": "L01",
      "slug": "command-console",
      "name": "Command-Console",
      "lineage_study_only": "1987 Federation starship computer; the tablet-precursor lineage",
      "lineage_decade": "1980s",
      "taxonomy": "command-control",
      "palette_logic": "Near-black void; flat pastel swatch blocks (blue, violet, apricot, salmon); high-chroma accent for active only",
      "type_stack": "Ultra-condensed grotesque caps for labels; humanist sans for body",
      "type_fonts": {"display": "Antonio", "body": "Nunito Sans", "mono": "IBM Plex Mono"},
      "hierarchy_device": "Rounded elbow frames, sweeping bars, pill buttons; color = system group",
      "motion_grammar": "Minimal activity; instant state flips; no ambient noise",
      "sound_cue": "Two-tone rising = open, reversed = close",
      "native_strength": "Calm status grids, many systems, no legend",
      "native_weakness": "Narrow all-caps at distance; too many simultaneous colors",
      "radius": "elbow",
      "glow": false,
      "tokens": {
        "void": "#050509", "panel": "#101018", "panel_raised": "#181826",
        "text": "#F2F0FF", "text_secondary": "#B9B4D6", "text_muted": "#7E7A99",
        "accent": "#9C8CFF", "accent_2": "#FFB27A",
        "nominal": "#7FC8FF", "caution": "#FFB27A", "critical": "#FF7A7A", "offline": "#5C5A6E",
        "border": "#2B2B3C"
      },
      "swatches": ["#7FC8FF", "#C9A5FF", "#FFB27A", "#FF9E9E"],
      "motion": {"boot_ms": 600, "arrival_ms": 200, "ease": "steps(1, end)"}
    },
    {
      "id": "L02",
      "slug": "tactical-hud",
      "name": "Tactical HUD",
      "lineage_study_only": "2008-era armored-suit helmet HUD and holographic workshop",
      "lineage_decade": "2000s",
      "taxonomy": "hud-ar",
      "palette_logic": "Warm gold/amber/red for the operator's own state; cool cyan for external data; optical flare accent",
      "type_stack": "Condensed technical sans; tabular numerals",
      "type_fonts": {"display": "Saira Condensed", "body": "Saira", "mono": "Share Tech Mono"},
      "hierarchy_device": "Reticle focus, radar arcs, gyroscopic rings, layered translucent panes",
      "motion_grammar": "Rings spin up on load; data snaps to reticle; flare on alert",
      "sound_cue": "Short click per state; rising tone on lock",
      "native_strength": "One critical number surrounded by context",
      "native_weakness": "Ornamental density; flares fight contrast",
      "radius": "small",
      "glow": true,
      "tokens": {
        "void": "#07090C", "panel": "#0E1319", "panel_raised": "#151C25",
        "text": "#F6EFDF", "text_secondary": "#C8B98F", "text_muted": "#7D7460",
        "accent": "#F2B441", "accent_2": "#4FD6E8",
        "nominal": "#4FD6E8", "caution": "#F2B441", "critical": "#F0553D", "offline": "#4A4F58",
        "border": "#2A3340"
      },
      "swatches": ["#F2B441", "#F0553D", "#4FD6E8"],
      "motion": {"boot_ms": 1200, "arrival_ms": 300, "ease": "cubic-bezier(.2,.8,.2,1)"}
    },
    {
      "id": "L03",
      "slug": "industrial-terminal",
      "name": "Industrial Terminal",
      "lineage_study_only": "1979 commercial-towship computer and its hazard signage",
      "lineage_decade": "1970s",
      "taxonomy": "command-control",
      "palette_logic": "Green or amber phosphor on pure black; hazard codes in red/yellow/blue",
      "type_stack": "Blocky monospace; character-cell grid",
      "type_fonts": {"display": "VT323", "body": "IBM Plex Mono", "mono": "IBM Plex Mono"},
      "hierarchy_device": "Text grids, blinking cursor, boxed readouts, pictogram wayfinding",
      "motion_grammar": "Line-by-line reveal; cursor blink; no smoothing",
      "sound_cue": "Heavy mechanical click; low hum",
      "native_strength": "Logs, audit trails, dense text",
      "native_weakness": "Cold and impersonal; no chart vocabulary",
      "radius": "none",
      "glow": false,
      "tokens": {
        "void": "#000000", "panel": "#050805", "panel_raised": "#0A120A",
        "text": "#9CFF8A", "text_secondary": "#5FBF52", "text_muted": "#2F6B2A",
        "accent": "#9CFF8A", "accent_2": "#FFC35A",
        "nominal": "#9CFF8A", "caution": "#FFC35A", "critical": "#FF5C5C", "offline": "#3A3A3A",
        "border": "#1F4D1B"
      },
      "swatches": ["#9CFF8A", "#FFC35A", "#FF5C5C", "#5CA8FF"],
      "motion": {"boot_ms": 1200, "arrival_ms": 0, "ease": "steps(1, end)"}
    },
    {
      "id": "L04",
      "slug": "vector-wireframe",
      "name": "Vector-Wireframe",
      "lineage_study_only": "1977 trench-run briefing and cockpit targeting computer",
      "lineage_decade": "1970s",
      "taxonomy": "hud-ar",
      "palette_logic": "Monochrome green or orange line on black; no fills",
      "type_stack": "Minimal; numeric readouts only",
      "type_fonts": {"display": "Orbitron", "body": "Share Tech Mono", "mono": "Share Tech Mono"},
      "hierarchy_device": "Wireframe geometry, converging reticle, countdown",
      "motion_grammar": "Slow line-draw; steady tick",
      "sound_cue": "Single tone per tick",
      "native_strength": "Long time-series, retro-archival, austerity",
      "native_weakness": "No area encoding; hard to show magnitude",
      "radius": "none",
      "glow": false,
      "tokens": {
        "void": "#000000", "panel": "#000000", "panel_raised": "#030603",
        "text": "#7DFF9A", "text_secondary": "#4FBF6A", "text_muted": "#2A6B3A",
        "accent": "#7DFF9A", "accent_2": "#FFA24A",
        "nominal": "#7DFF9A", "caution": "#FFA24A", "critical": "#FF6A4A", "offline": "#2A2A2A",
        "border": "#3FBF5A"
      },
      "swatches": ["#7DFF9A", "#FFA24A"],
      "motion": {"boot_ms": 1000, "arrival_ms": 400, "ease": "linear"}
    },
    {
      "id": "L05",
      "slug": "gestural-holographic",
      "name": "Gestural Holographic",
      "lineage_study_only": "2002 pre-crime scrubbing interface; 2009 alien-ship 3-axis nav",
      "lineage_decade": "2000s",
      "taxonomy": "investigation",
      "palette_logic": "Ghost blue-white translucent panes on dark; single warm accent",
      "type_stack": "Sparse clinical sans",
      "type_fonts": {"display": "Exo 2", "body": "Exo 2", "mono": "JetBrains Mono"},
      "hierarchy_device": "Floating layered panes, video-as-object, depth stacking",
      "motion_grammar": "Grab/slide/toss; parallax on scroll; elastic settle",
      "sound_cue": "Soft whoosh on move",
      "native_strength": "Investigation, drill-down, relationship graphs",
      "native_weakness": "Transparent-screen fallacy; gorilla-arm gestures",
      "radius": "medium",
      "glow": true,
      "tokens": {
        "void": "#070B14", "panel": "#0F1729", "panel_raised": "#172238",
        "text": "#E9F2FF", "text_secondary": "#A7BCE0", "text_muted": "#6478A0",
        "accent": "#8FD3FF", "accent_2": "#FFB45C",
        "nominal": "#8FD3FF", "caution": "#FFB45C", "critical": "#FF6B6B", "offline": "#3E4A63",
        "border": "#2A3A5C"
      },
      "swatches": ["#8FD3FF", "#FFB45C"],
      "motion": {"boot_ms": 900, "arrival_ms": 350, "ease": "cubic-bezier(.34,1.56,.64,1)"}
    },
    {
      "id": "L06",
      "slug": "hard-realism-tactical",
      "name": "Hard-Realism Tactical",
      "lineage_study_only": "2015 to 2022 hard-SF ship and civic terminals; faction-coded systems",
      "lineage_decade": "2010s",
      "taxonomy": "command-control",
      "palette_logic": "Restrained per-unit palettes on dark; utilitarian, glove-legible",
      "type_stack": "Clean technical sans; legible telemetry",
      "type_fonts": {"display": "Barlow Semi Condensed", "body": "Barlow", "mono": "Roboto Mono"},
      "hierarchy_device": "Per-faction color grammar; swipe-to-AR handoff; transparent panels used sparingly",
      "motion_grammar": "Grounded, physical easing; no theatrics",
      "sound_cue": "Muted confirm tone",
      "native_strength": "Multi-unit ops, plausible enterprise use",
      "native_weakness": "Understated; can read as generic",
      "radius": "small",
      "glow": false,
      "tokens": {
        "void": "#0B0D10", "panel": "#14181E", "panel_raised": "#1C222A",
        "text": "#EEF1F4", "text_secondary": "#AEB7C2", "text_muted": "#6F7A87",
        "accent": "#5FB4E5", "accent_2": "#E0A44A",
        "nominal": "#6FCF97", "caution": "#E0A44A", "critical": "#E5605F", "offline": "#4B535D",
        "border": "#2C343E"
      },
      "swatches": ["#5FB4E5", "#E0A44A", "#C56A9E", "#6FCF97"],
      "motion": {"boot_ms": 500, "arrival_ms": 250, "ease": "cubic-bezier(.4,0,.2,1)"}
    },
    {
      "id": "L07",
      "slug": "nasa-utilitarian",
      "name": "NASA-Utilitarian",
      "lineage_study_only": "2014 deep-space mission graphics run live in-camera; 1968 monolith-era telemetry",
      "lineage_decade": "2010s",
      "taxonomy": "command-control",
      "palette_logic": "Muted greens/ambers, low chroma; primary-block accents for system IDs",
      "type_stack": "Utilitarian monospace; three-letter system codes; extended geometric sans for headers",
      "type_fonts": {"display": "Michroma", "body": "IBM Plex Sans", "mono": "IBM Plex Mono"},
      "hierarchy_device": "Telemetry cells, orbital diagrams, dense-but-legible grids",
      "motion_grammar": "Steady refresh; no glow",
      "sound_cue": "Quiet beep per acknowledge",
      "native_strength": "Trust, precision, engineering audiences",
      "native_weakness": "Low visual excitement",
      "radius": "none",
      "glow": false,
      "tokens": {
        "void": "#0A0C0A", "panel": "#131612", "panel_raised": "#1B1F19",
        "text": "#E6E9DF", "text_secondary": "#B3B9A6", "text_muted": "#737A69",